{"type": "config", "name": "nts07_hw", "metricName": "effective_energy_mj", "metricUnit": "mJ", "bestDirection": "lower"}
{"run": 1, "commit": "autores", "metric": 25.94124013114754, "metrics": {"effective_cycles": 5386928.524590164, "effective_energy_mj": 25.94124013114754, "sram_kb": 772, "epe_drift": 0.0, "legacy_mc": 1.848, "h60_mc": 1.13344, "mac_mc": 0.9054885245901639, "fps_at_500mhz": 92.81727012296675}, "status": "keep", "description": "基线配置", "timestamp": 1781116953, "segment": 0}
{"run": 2, "commit": "autores", "metric": 29.478681967213113, "metrics": {"effective_cycles": 5793488.524590165, "effective_energy_mj": 29.478681967213113, "sram_kb": 772, "epe_drift": 0.0, "legacy_mc": 2.1, "h60_mc": 1.288, "mac_mc": 0.9054885245901639, "fps_at_500mhz": 86.30378706676912}, "status": "discard", "description": "关闭空窗跳过", "timestamp": 1781116953, "segment": 0}
{"run": 3, "commit": "autores", "metric": 12.97062006557377, "metrics": {"effective_cycles": 4934184.262295082, "effective_energy_mj": 12.97062006557377, "sram_kb": 772, "epe_drift": 0.0, "legacy_mc": 1.848, "h60_mc": 1.13344, "mac_mc": 0.45274426229508197, "fps_at_500mhz": 101.33387271747944}, "status": "keep", "description": "PE 256 路", "timestamp": 1781116953, "segment": 0}
{"run": 4, "commit": "autores", "metric": 51.88248026229508, "metrics": {"effective_cycles": 6292417.049180328, "effective_energy_mj": 51.88248026229508, "sram_kb": 772, "epe_drift": 0.0, "legacy_mc": 1.848, "h60_mc": 1.13344, "mac_mc": 1.8109770491803279, "fps_at_500mhz": 79.460721705522}, "status": "discard", "description": "PE 64 路", "timestamp": 1781116953, "segment": 0}
{"run": 5, "commit": "autores", "metric": 25.94124013114754, "metrics": {"effective_cycles": 5485488.524590164, "effective_energy_mj": 25.94124013114754, "sram_kb": 772, "epe_drift": 0.0, "legacy_mc": 1.848, "h60_mc": 1.232, "mac_mc": 0.9054885245901639, "fps_at_500mhz": 91.14958453720516}, "status": "discard", "description": "TX/SC 串行", "timestamp": 1781116953, "segment": 0}
{"run": 6, "commit": "autores", "metric": 25.94124013114754, "metrics": {"effective_cycles": 5386928.524590164, "effective_energy_mj": 25.94124013114754, "sram_kb": 516, "epe_drift": 0.0, "legacy_mc": 1.848, "h60_mc": 1.13344, "mac_mc": 0.9054885245901639, "fps_at_500mhz": 92.81727012296675}, "status": "discard", "description": "Window SRAM 256KB", "timestamp": 1781116953, "segment": 0}
{"run": 7, "commit": "autores", "metric": 12.97062006557377, "metrics": {"effective_cycles": 4934184.262295082, "effective_energy_mj": 12.97062006557377, "sram_kb": 772, "epe_drift": 0.0, "legacy_mc": 1.848, "h60_mc": 1.13344, "mac_mc": 0.45274426229508197, "fps_at_500mhz": 101.33387271747944}, "status": "discard", "description": "跳过+PE256+并行", "timestamp": 1781116953, "segment": 0}
{"run": 8, "commit": "autores", "metric": 12.97062006557377, "metrics": {"effective_cycles": 4934184.262295082, "effective_energy_mj": 12.97062006557377, "sram_kb": 516, "epe_drift": 0.0, "legacy_mc": 1.848, "h60_mc": 1.13344, "mac_mc": 0.45274426229508197, "fps_at_500mhz": 101.33387271747944}, "status": "keep", "description": "跳过+PE256+小SRAM", "timestamp": 1781116953, "segment": 0}
{"run": 9, "commit": "autores", "metric": 17.294160087431692, "metrics": {"effective_cycles": 5085099.016393443, "effective_energy_mj": 17.294160087431692, "sram_kb": 772, "epe_drift": 0.0, "legacy_mc": 1.848, "h60_mc": 1.13344, "mac_mc": 0.6036590163934425, "fps_at_500mhz": 98.3265022742114}, "status": "discard", "description": "跳过+PE192", "timestamp": 1781116953, "segment": 0}
{"run": 10, "commit": "autores", "metric": 25.819787628415302, "metrics": {"effective_cycles": 5382689.180327869, "effective_energy_mj": 25.819787628415302, "sram_kb": 772, "epe_drift": 0.0, "legacy_mc": 1.848, "h60_mc": 1.13344, "mac_mc": 0.9012491803278688, "fps_at_500mhz": 92.89037194035865}, "status": "discard", "description": "ep24 发放率", "timestamp": 1781116953, "segment": 0}
{"run": 11, "commit": "autores", "metric": 12.97062006557377, "metrics": {"effective_cycles": 4934184.262295082, "effective_energy_mj": 12.97062006557377, "sram_kb": 388, "epe_drift": 0.0, "legacy_mc": 1.848, "h60_mc": 1.13344, "mac_mc": 0.45274426229508197, "fps_at_500mhz": 101.33387271747944}, "status": "keep", "description": "终极组合", "timestamp": 1781116953, "segment": 0}
{"run": 12, "commit": "autores", "metric": 12.97062006557377, "metrics": {"effective_cycles": 5054184.262295082, "effective_energy_mj": 12.97062006557377, "sram_kb": 388, "area_mm2": 2.85, "epe_drift": 0.0, "legacy_mc": 1.848, "h60_mc": 1.13344, "mac_mc": 0.45274426229508197, "encode_mc": 0.12, "fps_at_500mhz": 98.92793259044186}, "status": "keep", "description": "终极组合（文献轮锚点）", "config": {"skip_empty_windows": 1, "pe_mac": 256, "tx_sc_parallel": 1, "window_sram_kb": 256, "weight_buffer_kb": 128}, "timestamp": 1781181634, "segment": 1}
{"run": 13, "commit": "autores", "metric": 12.92862006557377, "metrics": {"effective_cycles": 5039784.262295081, "effective_energy_mj": 12.92862006557377, "sram_kb": 388, "area_mm2": 2.7996, "epe_drift": 0.0, "legacy_mc": 1.848, "h60_mc": 1.13344, "mac_mc": 0.45274426229508197, "encode_mc": 0.1056, "fps_at_500mhz": 99.21059592584696}, "status": "keep", "description": "统一 ATLIF 编码器（共享比较器）", "config": {"skip_empty_windows": 1, "pe_mac": 256, "tx_sc_parallel": 1, "window_sram_kb": 256, "weight_buffer_kb": 128, "unified_atlif_encode": 1}, "timestamp": 1781181634, "segment": 1}
{"run": 14, "commit": "autores", "metric": 12.441046426229507, "metrics": {"effective_cycles": 4918664.262295082, "effective_energy_mj": 12.441046426229507, "sram_kb": 388, "area_mm2": 2.85, "epe_drift": 0.0, "legacy_mc": 1.764, "h60_mc": 1.08192, "mac_mc": 0.45274426229508197, "encode_mc": 0.12, "fps_at_500mhz": 101.65361434258507}, "status": "keep", "description": "Bishop TTB depth-2 打包", "config": {"skip_empty_windows": 1, "pe_mac": 256, "tx_sc_parallel": 1, "window_sram_kb": 256, "weight_buffer_kb": 128, "bishop_ttb_depth": 2}, "timestamp": 1781181634, "segment": 1}
{"run": 15, "commit": "autores", "metric": 12.97062006557377, "metrics": {"effective_cycles": 4498798.662295083, "effective_energy_mj": 12.97062006557377, "sram_kb": 388, "area_mm2": 2.85, "epe_drift": 0.0, "legacy_mc": 1.848, "h60_mc": 0.5780544, "mac_mc": 0.45274426229508197, "encode_mc": 0.12, "fps_at_500mhz": 111.14078169146666}, "status": "discard", "description": "FireFly 风格 popcount×64", "config": {"skip_empty_windows": 1, "pe_mac": 256, "tx_sc_parallel": 1, "window_sram_kb": 256, "weight_buffer_kb": 128, "firefly_popcount_par": 64}, "timestamp": 1781181634, "segment": 1}
{"run": 16, "commit": "autores", "metric": 12.92862006557377, "metrics": {"effective_cycles": 5039784.262295081, "effective_energy_mj": 12.92862006557377, "sram_kb": 388, "area_mm2": 2.7996, "epe_drift": 0.0, "legacy_mc": 1.848, "h60_mc": 1.13344, "mac_mc": 0.45274426229508197, "encode_mc": 0.1056, "fps_at_500mhz": 99.21059592584696}, "status": "discard", "description": "共享编码 16 lane 宽发射", "config": {"skip_empty_windows": 1, "pe_mac": 256, "tx_sc_parallel": 1, "window_sram_kb": 256, "weight_buffer_kb": 128, "unified_atlif_encode": 1, "shared_encode_lanes": 16}, "timestamp": 1781181634, "segment": 1}
{"run": 17, "commit": "autores", "metric": 12.399046426229507, "metrics": {"effective_cycles": 4904264.262295082, "effective_energy_mj": 12.399046426229507, "sram_kb": 388, "area_mm2": 2.7996, "epe_drift": 0.0, "legacy_mc": 1.764, "h60_mc": 1.08192, "mac_mc": 0.45274426229508197, "encode_mc": 0.1056, "fps_at_500mhz": 101.95209174270956}, "status": "keep", "description": "统一编码 + TTB-2", "config": {"skip_empty_windows": 1, "pe_mac": 256, "tx_sc_parallel": 1, "window_sram_kb": 256, "weight_buffer_kb": 128, "unified_atlif_encode": 1, "bishop_ttb_depth": 2}, "timestamp": 1781181634, "segment": 1}
{"run": 18, "commit": "autores", "metric": 12.399046426229507, "metrics": {"effective_cycles": 4374123.462295082, "effective_energy_mj": 12.399046426229507, "sram_kb": 388, "area_mm2": 2.7996, "epe_drift": 0.0, "legacy_mc": 1.764, "h60_mc": 0.5517792, "mac_mc": 0.45274426229508197, "encode_mc": 0.1056, "fps_at_500mhz": 114.30861618561912}, "status": "discard", "description": "文献终极组合", "config": {"skip_empty_windows": 1, "pe_mac": 256, "tx_sc_parallel": 1, "window_sram_kb": 256, "weight_buffer_kb": 128, "unified_atlif_encode": 1, "bishop_ttb_depth": 2, "firefly_popcount_par": 64, "shared_encode_lanes": 16}, "timestamp": 1781181634, "segment": 1}
