{"type":"config","name":"sparse_pipeline","metricName":"sops","metricUnit":"G","bestDirection":"lower"}
{"run":1,"commit":"baseline","metric":3.6219,"metrics":{"aee":1.584776,"aae":7.501204,"firing_rate":0.084961},"status":"keep","description":"PSN baseline (40 samples, upstream config)","timestamp":1778247216,"segment":0}
{"run":2,"commit":"baseline","metric":0,"metrics":{"aee":0,"aae":0,"firing_rate":0},"status":"crash","description":"Reduce num_bins to 8 (T change breaks checkpoint compatibility due to PSN [T,T] weight shapes)","timestamp":1778248581,"segment":0}
{"run":3,"commit":"baseline","metric":2.1649,"metrics":{"aee":6.818806,"aae":29.601548,"firing_rate":0.050784},"status":"discard","description":"spike_th=0.1 (binarize input): -40.2% SOPs but +330% AEE, too aggressive","timestamp":1778255086,"segment":0}
{"run":4,"commit":"baseline","metric":4.9255,"metrics":{"aee":6.587968,"aae":28.222764,"firing_rate":0.115541},"status":"discard","description":"spike_th=0.02: counterintuitive - INCREASED firing (+36%) vs baseline, AEE still bad (6.59). Binarization disrupts input stats","timestamp":1778255222,"segment":0}
{"run":5,"commit":"baseline","metric":5.2294,"metrics":{"aee":8.074630,"aae":42.985017,"firing_rate":0.122669},"status":"discard","description":"norm_input=std: z-score norm increased firing (+44%) and destroyed accuracy (AEE 8.07). Model expects minmax-trained input distribution","timestamp":1778258511,"segment":0}
{"run":6,"commit":"tokenmix_identity","metric":2.9495,"metrics":{"aee":2.102935,"aae":9.186614,"firing_rate":0.069188},"status":"keep","description":"Identity Token Mixer (no QKV attention, 5 epochs): SOPs -18.6% vs PSN baseline, AEE +32.7%. QKV attention confirmed redundant in SNN transformer!","timestamp":1778433231,"segment":0}
{"run":7,"commit":"tokenmix_conv","metric":3.0103,"metrics":{"aee":2.164126,"aae":9.963785,"firing_rate":0.070615},"status":"keep","description":"Conv Token Mixer (5 epochs): SOPs -16.9% vs PSN, AEE=2.16. Worse than Identity and Pool","timestamp":1778472380,"segment":0}
{"run":8,"commit":"tokenmix_pool","metric":2.9557,"metrics":{"aee":2.009216,"aae":9.051885,"firing_rate":0.069334},"status":"keep","description":"Pool Token Mixer (5 epochs): BEST so far! SOPs -18.4%, AEE=2.01. Simplest design wins","timestamp":1778472380,"segment":0}
